{
  "sequence_family_id": "SEQFAM-SEQ0015_MOMENTUM_BURST_CONTINUATION_V1",
  "sequence_ids": [
    "SEQ-0015"
  ],
  "detector_version": "seq0015_momentum_burst_detector.py@v1",
  "frozen_parameters": {
    "detector_formula": {
      "true_range_formula": "TR_t = max(high_t-low_t, abs(high_t-close_{t-1}), abs(low_t-close_{t-1}))",
      "atr_method": "Wilder EMA(alpha=1/14), causale, riusata identica da server/research_scripts/phase5/build_market_state.py:wilder_atr",
      "atr_period": 14,
      "burst_ratio_formula": "burst_ratio_t = TR_t / ATR_{t-1}",
      "burst_ratio_denominator_justification": "ATR_{t-1} usa esclusivamente informazione fino a t-1. ATR_t (come verificato leggendo wilder_atr() e il suo uso reale in server/research_scripts/phase5/build_events.py:99 per VOLATILITY_EXPANSION/H008_EVENT_VOLATILITY_EXPANSION, REFUTED) include TR_t nella propria media mobile EMA. Correzione terminologica (Phase 7.4A Integrity Patch sec.4): ATR_t NON e' 'non causale' - il suo valore e' regolarmente disponibile a close(t) e non guarda alcun dato futuro. La formulazione corretta e': causale al momento della decisione ma self-normalized/endogeno rispetto alla propria anomalia (TR_t contribuisce ad ATR_t e ne attenua meccanicamente il rapporto burst_ratio proprio nei casi piu' estremi). E' per questo motivo endogeno/di auto-diluizione - non per un problema di causalita' temporale - che si preferisce ATR_{t-1} come denominatore della SOGLIA (mai per la normalizzazione dell'outcome, dove ATR_t resta corretto - vedi outcome_atr_normalization). Verificato esplicitamente come richiesto (sec.1/sec.4), non solo assunto.",
      "threshold_method": "CAUSAL_ROLLING_PERCENTILE",
      "threshold_percentile": 90,
      "threshold_window_bars": 252,
      "threshold_minimum_warmup_bars": 252,
      "threshold_rationale": "CLAIM-0042/CLAIM-0043 (fonte esterna di SEQ-0015) descrivono un meccanismo di soglia scalata alla volatilita' ma NON forniscono un moltiplicatore ATR unico e canonico per 'range anomalo'. Non essendo disponibile un ancoraggio esterno univoco, si usa una regola distribuzionale calcolata SOLO sul passato: percentile 90 su una finestra rolling causale di 252 barre H4, esclusa la barra corrente (shift di 1). 252 e' la stessa finestra gia' usata come convenzione di progetto per atr_percentile in server/research_scripts/phase5/build_market_state.py:P['atr_percentile_window'] - non scelta ad-hoc per questa sequence. Percentile 90 e finestra 252 sono FISSATI ORA.",
      "not_tried_alternative_thresholds": "Nessun test di soglie alternative (es. percentili 85/95 o moltiplicatori fissi 1.2/1.5/1.8/2.0xATR) e' stato eseguito su dati NEXUS prima di congelare questa scelta."
    },
    "direction_policy": {
      "rule": "BUY se close_t>open_t, SELL se close_t<open_t, NO_EVENT se close_t==open_t (doji/zero-body)",
      "no_event_handling": "Una barra doji che supera la soglia di burst_ratio NON genera alcun sequence_event - conta come evento scartato, mai incluso in un pool con direzione arbitraria.",
      "dependency_on_future_bars": "NESSUNA - dipende esclusivamente da open_t/close_t, gia' noti a observation_cutoff=close(t)."
    },
    "observation_timing": {
      "event_a_index": "t (barra H4 con burst_ratio_t sopra soglia)",
      "observation_cutoff_index": "close(t)",
      "transition_complete_index": "close(t) - MOMENTUM_BURST non ha transition_conditions separate (market_sequence_registry_v1.json:SEQ-0015)",
      "prediction_start_index": "close(t), verificato >= transition_complete_index da sequence_causality_guard.py",
      "outcome_window_start_index": "t+1 - nessun prezzo con indice <= t entra nel calcolo dell'outcome."
    },
    "state_snapshot_pre_burst": {
      "principle": "Tutte le feature di stato per il baseline matching sono calcolate a t-1, mai a t - la barra t e' essa stessa l'evento anomalo, includerla nel proprio stato di matching sarebbe circolare.",
      "volatility_state_pre_burst": "Terzile (LOW/MED/HIGH) di atr_percentile a t-1, terzili fissati SOLO su development_discovery (convenzione H006/Phase7.1).",
      "trend_state_pre_burst": "Terzile (DOWN/FLAT/UP) di ema_slope_atr_norm a t-1, stessa convenzione di terzili fissati solo su discovery.",
      "directional_efficiency_excluded": "NON incluso come dimensione di matching separata: il meccanismo causale dichiarato (CLAIM-0042/0043) riguarda l'espansione di volatilita', non l'efficienza del movimento pregresso; trend_state_pre_burst copre gia' la componente direzionale rilevante. Aggiungere directional_efficiency aumenterebbe i gradi di liberta' del matching senza una giustificazione causale distinta, in contrasto con la scelta di questa family per 'poche dimensioni, pochi gradi di liberta''."
    },
    "episode_rule": {
      "natural_horizon_bars": 40,
      "overlap_policy": "COLLAPSE_TO_FIRST",
      "rationale": "I burst possono comparire su barre H4 consecutive o quasi-consecutive durante la stessa espansione direzionale - non sono letture indipendenti dello stesso fenomeno. episode_gap_rule=3 barre (12h): due burst a non piu' di 3 barre di distanza sono trattati come la stessa espansione; un gap piu' ampio senza ulteriori burst e' trattato come espansione conclusa. COLLAPSE_TO_FIRST usa la prima barra dell'espansione come rappresentante (anti-cherry-pick, gia' incorporato in sequence_episode_engine.py). natural_horizon=40 barre H4, identico all'orizzonte dell'outcome primario - stessa convenzione di H006/Phase7.1, non scelto per questa sequence specifica.",
      "event_cluster_rule_bars": 3,
      "outcome_overlap_rule": {
        "concept_distinction": "event_cluster_rule (3 barre) risponde 'e' la stessa espansione fisica locale?' - usato per EPISODE_VIEW. outcome_overlap_rule risponde 'le finestre di misura dell'outcome si sovrappongono, anche se le espansioni fisiche sono diverse?' - due episodi a gap>3 ma con outcome window sovrapposte NON sono osservazioni indipendenti solo perche' superano gap=3.",
        "outcome_overlap_embargo_bars": 39,
        "embargo_derivation": "natural_horizon-1 = 40-1 = 39: due eventi a distanza d hanno outcome window sovrapposte se e solo se d<natural_horizon (finestra [t+1,t+natural_horizon]), quindi l'ultimo d che sovrappone e' natural_horizon-1.",
        "method_chosen": "D - combinazione predefinita: (1) declustering per embargo (embargo=39) sui rappresentanti di EPISODE_VIEW per ottenere INDEPENDENT_VIEW (sequence_episode_engine.build_outcome_independent_view), usata come n per Wilson/two-proportion/bootstrap su TUTTI i 7 outcome; (2) moving block bootstrap come diagnostica di dipendenza residua quando il candidato risulta DEPENDENCE_SENSITIVE anche dopo l'embargo.",
        "alternatives_considered": {
          "A_episode_clustering_overlap_aware": "Scartata come UNICA soluzione: ridefinire event_cluster_rule stesso in funzione dell'overlap dell'outcome confonderebbe due concetti distinti (espansione fisica locale vs indipendenza statistica dell'outcome) nello stesso parametro, perdendo la possibilita' di diagnosticare separatamente 'quante espansioni fisiche' vs 'quante osservazioni indipendenti'.",
          "B_embargo_only": "Insufficiente da sola: un embargo a larghezza fissa=natural_horizon-1 elimina la pseudo-indipendenza pairwise ma non cattura dipendenza seriale residua su catene piu' lunghe (es. una sequenza di burst ciascuno a 38 barre dall'altro, che coprirebbe centinaia di barre pur essendo ogni singola coppia sotto l'embargo).",
          "C_bootstrap_only": "Insufficiente da sola: senza prima correggere l'n nominale con l'embargo, il bootstrap a blocchi verrebbe applicato a un campione gia' contaminato da pseudo-indipendenza pairwise ovvia (esattamente il caso t=100/t=105 dell'esempio) - il bootstrap correggerebbe la STIMA di incertezza ma non l'inflazione grossolana del conteggio n stesso.",
          "D_chosen": "Scelta: l'embargo risolve la pseudo-indipendenza pairwise ESATTA e ovvia (il problema descritto esplicitamente dall'utente), il bootstrap resta come rete di sicurezza per dipendenza residua piu' sottile - nessuna delle due soluzioni da sola e' sufficiente, la combinazione si allinea anche alla 'future_direction' gia' dichiarata in policies/minimum_evidence_gates.json (stimare direttamente l'incertezza con block bootstrap quando DEPENDENCE_SENSITIVE)."
        },
        "synthetic_tests_ref": "server/research_scripts/phase7/phase7_3/engine/sequence_episode_engine.py (Caso 4/5/6/7 nel __main__) + server/research_scripts/phase7/phase7_4/test_phase7_4a_integrity_patch.py"
      }
    },
    "control_exclusion_window": {
      "exclusion_buffer_bars": 40,
      "rule": "Per un evento a event_a_index=t sono esclusi dal SUO pool di controllo: (1) la barra t stessa; (2) qualunque barra r con |r-t|<=40 barre (evita che un controllo condivida il tratto di prezzo usato per l'outcome dell'evento); (3) qualunque altra barra MOMENTUM_BURST dello stesso episode_id; (4) qualunque barra di split diverso (enforcement strutturale gia' esistente - BaselineEngineV4.match() + cross_split_safety.py, riusati senza modifiche)."
    },
    "candidate_family": {
      "family_id": "SEQFAM-SEQ0015_MOMENTUM_BURST-CANDIDATES-V1",
      "candidates": [
        {
          "candidate_id": "CAND-P74-SEQ0015-BOTH",
          "direction": "BOTH",
          "role": "PRIMARY_INFERENTIAL"
        },
        {
          "candidate_id": "CAND-P74-SEQ0015-BUY",
          "direction": "BUY",
          "role": "PRIMARY_INFERENTIAL"
        },
        {
          "candidate_id": "CAND-P74-SEQ0015-SELL",
          "direction": "SELL",
          "role": "PRIMARY_INFERENTIAL"
        }
      ],